linkedin_job_id,company_name,linkedin_company_page,title,job_location,posted_date,applicant_count,salary,description
4191117617,Automattic,https://www.linkedin.com/company/automattic/life,Experienced Software Engineer,Remote,Reposted 1 week ago,,Not specified,"About the job WordPress doesn’t try to keep its users inside walled gardens, a rare thing in a world that is dangerously moving away from the open web. Instead, WordPress gives them the freedom to build a business website, an online store, or a personal blog – the way they like it. Big sites or small, using the community-run open source project or Automattic’s WordPress.com, vanilla or customized with hundreds of plugins, WordPress users always get to own and control their data, their expression, and their freedom. We’re always looking for talented and experienced engineers worldwide, excited to help Automattic’s product ecosystem, and join our mission to make the web a better place. What have we worked on recently? AI is at the heart of many new product developments and powers a lot of our day-to-day development workflows. WooCommerce is the most popular and most flexible e-commerce platform on the web. We're working tirelessly on giving you all the control, while keeping the platform fast and stable. Gutenberg is a new block-level editor for WordPress with clean abstractions for users, too, not just developers. Tumblr is a microblogging social network where users create, share, and follow what they love. To view more of our recent work, check out our longer product list on Automattic.com. How do we work? We’re kind to each other and our users – we build a positive, supportive, and inclusive culture of cohesive teams focused on building useful products for our customers. We work as a global and distributed workforce resulting in a unique way of working built around our creed. We offer flexible work arrangements allowing our team members to work when they feel best. We open-source! We’re cool with open-sourcing everything except passwords, or secret keys. We ship often, deploying many times daily with the help of peer code review, continuous integration, and our global workforce in over 70 countries. We welcome collaboration, and you can be involved in any discussion across our many communication channels. We encourage you to learn and develop and we support you with what you need – covering expenses, easy internal mobility, coaching. Enough about us, let‘s talk more about you. Working at Automattic might be a good fit if: You care and often obsess over the quality and the details of your work. Debugging any problem is a fun challenge and not a chore. Understanding the layers of abstraction below and above your work isn't something extra, but how you operate. You have production experience with several programming languages, frameworks, and paradigms. We mostly use PHP and JavaScript at Automattic, we expect you to be comfortable with the idea of becoming an expert in these languages, even if being one isn't a requirement to apply. In your mind abstraction is associated as much with cost as it is with value. You have experience working at scale – it can be on the backend and performance side, or via the complexity of interacting with a multi-million diverse userbase. Are open and able to travel 3-4 weeks per year to meet up with your teammates in person. These are exciting times at Automattic and you’ll have a unique opportunity to shape the future of our products. Join us! We look forward to hearing from you. Curious who works in engineering at Automattic? Meet our Code Wranglers – Brandon, Jeremy, Mark, Jennifer, Roy and Kat! What to Expect: We know applying to jobs can be stressful and we want to ease the stress by giving clear expectations upfront about our process. We’ve outlined everything you need to know here including all of the steps in the process as well as how we approach hiring. Please note that we are paying extra attention to your answers to the questions in the application form. They are a significant part of the hiring process, and we will review them just like we would review any other step of the hiring process. We’re always iterating so if you happen to join us in the process, please feel free to offer feedback on what else we can include there! Salary range: $70,000-$170,000 USD. Please note that salary ranges are global, regardless of location, and we pay in local currency. We are searching for high-caliber candidates with the skills and qualities to have a net positive for Automattic. Pay will reflect the potential contribution and the impact you can bring, which may, in some cases, go beyond the range stated. We’re pleased to offer a straightforward, competitive base salary, providing financial clarity without complex variable components. This isn’t your typical work-from-home job: we are a fully-remote company with an open vacation policy. To see a full list of benefits by country, consult our Benefits Page. And check out these links to learn more about How We Hire and What We Expect from Ourselves. ABOUT AUTOMATTIC Now in our 20th year, we’re the people behind WordPress.com, WooCommerce, Tumblr, Simplenote, Jetpack, Longreads, Day One, PocketCasts, Beeper, and more. We believe in making the web a better place. We’re a distributed company with more than 1400 Automatticians in nearly every corner of the globe, speaking over a hundred different languages. Enriched by this diversity, we’re united by a singular mission: to democratize publishing, commerce, and messaging so anyone with a story can tell it, anyone with a product can sell it, and everyone can manage their communications from a single source. In short, we help maintain a balance in society, creating and continually refining powerful tools people can use to compete fairly—regardless of income, gender, politics, language, or where they live in the world. We believe in Open Source, and the vast majority of our work is available under the GPL. Automattic is a Most Loved Company and Disability Confident Committed. (Here’s what that might mean for you.) Learn more about our dedication to diversity, equity, and inclusion and our Employee Resource Groups. If you need disability-related accommodations during the application or interview process, please fill out this form. We are committed to ensuring an accessible hiring process for all candidates. To learn about how we handle your data, please review our Privacy Policy. You can track your application status and more at MyGreenhouse. All qualified applicants will receive consideration for employment without regard to race, color, religion, sex, sexual orientation, gender identity, national origin, disability, or status as a protected veteran."
4318334763,Mindrift,https://www.linkedin.com/company/mindrift-ai/life,English AI Trainer - Writers,Remote,1 week ago,,Not specified,"About the job This opportunity is only for candidates currently residing in the specified country. Your location may affect eligibility and rates. At Mindrift, innovation meets opportunity. We believe in using the power of collective intelligence to ethically shape the future of AI. What we do The Mindrift platform connects specialists with AI projects from major tech innovators. Our mission is to unlock the potential of Generative AI by tapping into real-world expertise from across the globe. About the Role If you’re a professional who works with text, Mindrift offers a unique opportunity to apply your writing, editing, and creative and communication skills to an AI training project. As an AI Trainer - Writer, your work will help train AI models, shaping how they understand and generate human-like text. This isn’t just traditional writing—you’ll be crafting text that teaches AI reasoning, logic accuracy, nuance, and clarity. This is a freelance role for short-term projects, and your typical tasks may include: Crafting original, clear, and fact-checked responses based on project guidelines. Following style and quality standards to ensure consistency. Collaborating with Quality Assurance Specialists to refine and improve content. How to get started Simply apply to this post, qualify, and get the chance to contribute to projects aligned with your skills, on your own schedule. From creating training prompts to refining model responses, you’ll help shape the future of AI while ensuring technology benefits everyone. Requirements You hold a Bachelor’s Degree in any subject field. You have at least 1 year of professional or educational experience in any field. Your level of English is proficient (C2). You are ready to learn new methods, able to switch between tasks and topics quickly and sometimes work with challenging, complex guidelines. Our freelance role is fully remote so, you just need a laptop, internet connection, time available and enthusiasm to take on a challenge. Why this freelance opportunity might be a great fit for you? Get paid for your expertise, with rates that can go up to $15/hour depending on your skills, experience, and project needs. Take part in a part-time, remote, freelance project that fits around your primary professional or academic commitments. Work on advanced AI projects and gain valuable experience that enhances your portfolio. Influence how future AI models understand and communicate in your field of expertise."
4333737515,micro1,https://www.linkedin.com/company/micro1/life,Korean Language Reviewer - AI trainer,Remote,1 day ago,,Not specified,"About the job Job Title: Korean Language Reviewer - AI Trainer Job Type: Part-time Location: Remote Job Summary: Become a key contributor to our customer’s team as a Korean Language Reviewer - AI Trainer. In this remote, part-time role, you will leverage your deep understanding of the Korean language and culture to evaluate, refine, and advance the linguistic capabilities of AI-driven technologies. Play a vital part in ensuring the authenticity, fluency, and accuracy of AI-generated Korean content. Key Responsibilities: Review and analyze AI-generated Korean text and voice data for linguistic accuracy and natural expression. Assess and differentiate between native and non-native Korean speech and writing patterns. Deliver comprehensive feedback to improve AI comprehension of Korean grammar, idioms, and regional nuances. Collaborate with technical teams to enhance AI voice models, with a focus on accent recognition and clarity. Annotate and evaluate datasets for pronunciation, vocabulary, and language quality. Support the development of robust frameworks for native Korean identification and language assessment. Maintain thorough documentation of evaluations and actively engage in quality assurance processes. Required Skills and Qualifications: Native-level proficiency in Korean with exceptional written and verbal communication skills. Strong ability to identify and assess diverse Korean accents and dialects. Academic background in Korean Studies, Linguistics, or a related field. Meticulous attention to detail and a passion for language excellence. Experience in content reviewing, editing, language assessment, or similar roles. Proven skill in delivering clear, actionable, and constructive feedback. Self-driven and capable of producing top-quality work independently in a remote environment. Preferred Qualifications: Experience with AI training, speech data annotation, or machine learning projects targeting the Korean language. Knowledge of voice-based technologies or involvement in linguistic resource development. Advanced degree or recognized certification in Korean linguistics or related disciplines."
4318352350,Deluxe,https://www.linkedin.com/company/deluxe1915/life,Freelance English Transcriber,Remote,1 week ago,Over 100 applicants,Not specified,"About the job Job Freelance English Scripting Editor / English Scripting Transcriber Position Summary Scripting transcribers work with audiovisual content to create Dialogue Lists, which are an essential part of the dubbing process. Dialogue lists are essential for dubbing studios for recording and dubbing dialogue into other languages. Dialogue Lists may include the following: an economical description of the scenes or action of the film impeccable verbatim transcription of the audio including dialogue and nonverbal elements that accurately represent the content and nature of the project descriptive and context-based annotations to ensure proper translation and treatment of the material identification of the people or characters who narrate or recite the dialogue of the project timecode that shows where in the film these elements appear. General Requirements Native level proficiency of US/ UK English (IRL Level 5) an excellent knowledge of grammar, spelling and punctuation and ongoing engagement with the language cultural sensitivity and extensive understanding of terminological/cultural nuances deep understanding of culture from the region. Is a plus: Knowledge of cinema and the film industry not limited to film history, global & local cinema trends etc. but also include the business side of the industry. Is a plus: Degree and/or professional training in Dubbing, subtitling and media OR audiovisual localization of any kind. Is a plus:2 years of experience in review, editing, proofreading. Is a plus: Degree and/or professional training in dubbing or text/video/audio editing. Key Competencies Creation of Empty Shell files scripts for non-English content, including timing dialogue boxes and adding nonverbal element like character tagging. English verbatim transcription of the audio including dialogue and nonverbal elements that accurately represent the content and nature of the project. Creation of explanatory and context-based annotations to ensure faithful transcription of English material. Familiarity with and excellent comprehension of a wide variety of dialects and accents for the source language. Can research independently and apply subjective judgement Can adapt to new specs and requirements and apply knowledge to unexpected scenarios Please note, only suitable applicants to this role will be contacted to take this further."
4319087507,Cosmo,https://www.linkedin.com/company/cosmo-usa/life,Reading and Writing Teacher,"Yokohama, Kanagawa, Japan",1 week ago,,Not specified,"About the job Teach online at Cosmo 1:1! Join Cosmo 1:1 (formerly ClassUp), the premiere online learning platform that connects K-12 students in the US, Canada, and across Asia with tutors from top Universities and Colleges for personalized lessons. As a tutor for Cosmo 1:1, you will have a flexible and consistent schedule that you set. For this role you'll be teaching ESL students based in APAC using the Cosmo curriculum. This is the perfect opportunity for experienced educators to connect with students in an after school setting. You will meet with your students at a set time each week for 50 minute 1 on 1 lessons. As a Cosmo 1:1 tutor you will build a welcoming and fun learning environment for your student as you help them grow. It is important for our teachers to be reliable role models for our students who come to class well prepared, on time, and with a passionate and kind demeanor. The pay rate for this position is $20 Singapore dollars per class plus additional incentives. Cosmo Teacher Responsibilities: Provide personalized 1 on 1 instruction for your students Update your availability in the Cosmo App in a timely manner Prepare appropriate lesson materials for the student's age and ability Submit Class Feedback after each lesson Communicate with parents and students in a professional manner Attend all classes on time and in a professional setting Communicate with Cosmo staff Minimum Requirements: Bachelor’s Degree 3 years of experience teaching grades K-12 in ELA Experience with K-12 ELA standards Teaching qualification preferred but not required Fast and reliable internet connection and access to a Windows or Mac PC with a minimum CPU of 6000 Able to commit to a minimum of 6 months of teaching with Cosmo1:1 Available between 3-8 PM Hong Kong Time Zone on Monday through Friday or during the weekends Minimum of 20 hours of availability on a weekly basis Access to a private and quiet location Passion for helping students learn Cosmo 1:1 Teachers are: Approachable: They are able to build rapport and make students feel comfortable in an online classroom environment. Students feel comfortable approaching our teachers with questions and make them feel relaxed throughout class. Patient:They take the time and effort to make sure students understand the complex subjects and materials at whichever speed is required by the student. Adaptive: They are able to tailor the lesson and environment to each individual student, their needs and learning capabilities. Considerate: They have the emotional intelligence to understand when a student is feeling discouraged and can then build up their confidence from there. Enthusiastic: They are passionate about education and have a contagious energy that makes for a fun environment for the students. Reliable: They come to class on time, prepared, and ready to tackle the students needs."
4311544559,EQL Edtech (sales & engineering talent),https://www.linkedin.com/company/eqledtech/life,Senior Flutter Developer - Health & Education Technology Platform,Remote,4 weeks ago,Over 100 applicants,Not specified,"About the job 🌟 Senior Flutter Developer - Health & Education Technology Platform 🏛 About Our Client Our client is building a category‑defining health and education technology platform that transforms how children, families, and professionals connect. Their ecosystem integrates Medicaid billing, compliance, and multi‑stakeholder applications into a seamless, scalable solution with national growth potential. This is not a routine developer role. It is an invitation to join a mission‑driven, founder‑led organisation operating at the highest standards of speed, precision, and impact. 💼 The Role We are seeking a Senior Flutter Developer of exceptional calibre to join the team ASAP. You will be entrusted with delivering features that directly influence sales success, pilot adoption, and long‑term platform architecture. This role demands independence, initiative, and technical mastery. You will be expected to think strategically, execute rapidly, and raise the bar for what's possible in Flutter development. 🔧 Key Responsibilities Sales Enablement: Build a polished, responsive demo app to showcase to prospective clients Product Evolution: Extend the Flutter app with advanced features (e.g., dictation) and adapt it for multiple therapy specialisms Technical Stewardship: Assess the Ruby on Rails backend, identify technical debt, and propose refactoring strategies Operate as a trusted technical partner to the senior leadership team Requirements 🎯 Candidate Profile Proven track record of shipping Flutter/Dart applications at scale Mastery of mobile architecture, state management, and performance optimisation Analytical mindset with the ability to diagnose and improve backend systems Exceptional English communication skills and presence in cross‑functional settings Thrives in fast‑moving, high‑expectation environments Bonus: experience in healthtech, edtech, or compliance‑driven platforms Benefits 💰 Compensation & Logistics Salary: Dependent on expertise/experience Start Date: November 2025/ASAP Location: Remote (US or Europe time zones) Engagement: Full‑time 🌍 Why This Role is Different Operate at the intersection of elite technology and meaningful social impact Join a founder‑calibrated team that values clarity, adaptability, and uncompromising standards Shape a platform with national expansion potential Work on AI‑powered, compliance‑critical applications that demand precision and creativity ⚡ Exclusive Recruitment Partnership EQL EdTech are the exclusive recruitment partner for this appointment. All applications and early shortlisting will be managed directly by us, ensuring a rigorous, high‑bar process that admits only the most exceptional candidates. If you are not operating at the very top of your field, this role is not for you."
4318247603,ROYAL AGENT,https://www.linkedin.com/company/royal-agent-inc/life,【Fintech Company/Fully Remote】Web Application Engineer【Intermediate Japanese Required】,Remote,2 weeks ago,63 applicants,Not specified,"About the job □■━━━━━━━━━━━━━━━━━━━━━━━━━━━━━ ▶︎Overview *position : Web Application Engineer(Python/Vue/ASW) *salary : From 6 mil JPY. to 12 mil JPY. *language : English and Japanese(N2 level required) *remote : Fully remote ▶︎Comments from senior consultant Hao Recently acquired by a major global payment company, this firm has become even more rock-solid in its foundation. It boasts a diverse team of international engineers and promotes a flexible work culture. What makes it stand out is its unwavering investment in technology and the vibrant knowledge-sharing among engineers from all kinds of backgrounds. ▶︎About the Company A provider of online loan management systems for financial institutions. The company values three things: work-life balance, diversity and a flat organization. ▶︎About the Role ・Development of new features, improvements, and customizations for the online lending platform, Credit Engine Platform. ・Development of new features, improvements, and API integrations for Credit Engine DataHub to facilitate external service collaboration, including web scraping implementation. ・Development of a web application for the online lending platform using Vue.js and REST APIs. ・Creation of both user interfaces and operator interfaces. ・Other new product development as needed. ▶︎Development environment Frontend: JS/TS, Vue.js, Tailwind CSS, Storybook Backend: Python, Django Database: PostgreSQL (Amazon RDS) Testing: Autify CI/CD: GitHub Actions, AWS CodeBuild/CodeDeploy/CodePipeline Infrastructure: AWS (AWS CDK, ECS Fargate, etc.), Azure (OpenAI Service, etc.) Data Analysis: Python, scikit-learn, Amazon SageMaker Design: Figma Other Tools: Slack, GitHub, Asana, etc. Provision of MacBook,Access to GitHub Copilot,Use of paid editors (e.g., PyCharm) available ▶︎Qualifications 【Required】 ・Experience in SPA development using frameworks such as Vue.js, React, or Angular. ・Development experience with frameworks like Django, Ruby on Rails, or Laravel. ・Japanese language proficiency at N2 level or higher. 【Preferred】 ・Skills in website design with consideration for UX/UI on mobile and PC. ・Experience in Web API design and development. ・Experience in product development and project development. ▶︎Holidays and Leave Weekends and public holidays Summer vacation (up to 5 days) Year-end and New Year vacation Special paid leave (for celebrations, jury duty, self-care, etc.) ▶︎Allowances and Benefits Comprehensive social insurance (employment, labor accident, health, and welfare pension) Kanto IT Health Insurance Association membership Full remote work possible (with onboarding allowance as per 2023 regulations) Proximity allowance (as per regulations) Book purchase subsidy (as per regulations) Study group subsidy (as per regulations) Sick child care system Qualification acquisition support system Cabinet Office babysitter subsidy discount voucher system available Free coffee Free address system Break area available Access to SENQ facilities □■━━━━━━━━━━━━━━━━━━━━━━━━━━━━━"
