linkedin_job_id,company_name,linkedin_company_page,title,job_location,posted_date,applicant_count,salary,description
4320183222,Braintrust,https://www.linkedin.com/company/usebraintrust/life,"English Language Experts - Writers (Freelance, Remote, 20+ openings)",Remote,4 days ago,,Not specified,"About the job Job Description English Language Experts Are you excited about writing, research, and language — and eager to apply your skills to the future of AI? This is a fully remote, fully flexible role where you decide your schedule. Not only will you be able to implement your writing and language skills in impactful projects, but you’ll also have the opportunity to build passive income forever through our referral program, earning as long as your referred candidates continue working. 📌 To ensure the success of your application, we strongly recommend watching our video guide on the application process before applying. The Role: Where Your Language Expertise Meets AI Innovation As an AI Data Trainer, you will: Develop AI Training Content: Create detailed prompts in various topics and responses to guide AI learning, ensuring the models reflect a comprehensive understanding of diverse subjects. Optimize AI Performance: Evaluate and rank AI responses to enhance the model's accuracy, fluency, and contextual relevance. Ensure Model Integrity: Test AI models for potential inaccuracies or biases, validating their reliability across use cases. Bring your expertise - we’ll take care of the rest with a tailored onboarding experience that sets you up for success from day one. Your Profile Apply if this sounds like you (even if not every point applies): You are a student or graduate with a Bachelor’s or Master’s degree in Linguistics, Communication, or a related field. You have a strong command of written English, with good grammar, syntax, and stylistic versatility. You enjoy doing research, exploring new topics, and turning ideas into clear, structured content. You like creative writing, experimenting with different tones and formats. You bring an analytical mindset and pay attention to detail, delivering quality work independently. You might even have experience with AI/LLM training — if so, that’s a great plus, but it’s not required. Commitment This is a fully flexible, remote role - you choose when and where you work. To set yourself up for success on the project, it makes sense to dedicate at least 20 hours per week or more, while still keeping a healthy balance that fits your lifestyle."
4316691789,PeopleX Inc. Active Connector Group,https://www.linkedin.com/company/active-connector/life,Back End Developer (Ruby on Rails),Remote,2 weeks ago,53 applicants,Not specified,"About the job Job Title: Backend Developer (Ruby on Rails) Location: Fully Remote (Work from anywhere in Japan) Employment Type: Full-time (Regular Employment) Salary: up to 10M JPY/year Japanese Level: Equivalent to JLPT N2 or higher All applicants must be residing in Japan with Valid working visa for foreigners About the Company: A fast-growing tech company in Japan providing a platform that connects individuals with flexible, short-term work opportunities. The service allows people to find jobs that fit their schedules while helping businesses quickly fill staffing needs. With a mission to enrich people’s time and create new ways of working, the company focuses on leveraging technology to promote flexible employment and address social challenges in the labor market. Key Responsibilities: Design, develop, review, and release web applications using Ruby on Rails. Identify technical issues within and outside the team, propose and implement solutions. Review specifications related to your area of responsibility, and respond to inquiries, including technical research Work with the engineering manager and scrum master to progress projects. Participate in various scrum events held within the team People management and scrum master roles are not included in this job description, as we have specialized members. Ideal Candidate: Shares and aligns with the company’s mission and vision Demonstrates the company’s core values in daily work Values teamwork and collaborates effectively with others Strong logical thinking and problem-solving skills Highly motivated toward personal and professional growth Requirements: Must-Have: More than 5 years of experience in web application development and operation including 3 years or more of experience in web application development and operation using Ruby on Rails Experience in a series of developments from requirements definition, design, implementation, testing, release, and maintenance Experience in continuous development using software testing Experience in team development using Git Nice-to-Have: Experience with agile development projects using a Scrum system Experience building and operating web applications using AWS or Google Cloud Experience with software architecture design and improvement or middleware selection and implementation Experience with design and improvement that takes performance into consideration when handling large amounts of traffic and data Perks & Benefits: Flextime with no mandatory core hours Full transportation cost coverage (if visiting office occasionally) Health insurance Weekends and national holidays off End of year and New Year holidays Trial period: 6 months (standard) We have more positions available—if you're open to new opportunities, don’t hesitate to apply! Job ID: 06626"
4316361224,Volga Partners,https://www.linkedin.com/company/volga-partners/life,Language Data Quality Reviewer for Korean (Freelance/Task-based),Remote,2 weeks ago,Over 100 applicants,Not specified,"About the job Volga Partners, a U.S.-based company, specializes in Artificial Intelligence and machine learning, catering to top technology giants and multinational corporations. Beyond that, we offer a spectrum of services including IT, business process outsourcing, advanced professional services, and crowdsourcing in both established and emerging markets. Our client is seeking candidates interested in Freelance/Task-based work for an ongoing project. The hours will align with the IST time zone. PLEASE REVIEW THE MANDATORY REQUIREMENT BEFORE APPLYING: Must be able to read and write in Korean and English. Must be comfortable and understand this is a task-based role. Task-Based Project Scope This is a freelance, task-based role designed for those seeking supplemental income. It’s essential to understand the nature of freelance work—tasks will be assigned as they become available, and work may be irregular or intermittent. Notifications will be sent via WhatsApp, email, or Slack (after onboarding through the client’s portal). All tasks are offered on a first-come, first-served basis, making this role ideal for individuals who are comfortable with flexible, on-demand work. Mandatory Requirements Must have reliable high-speed internet and a functioning device (laptop, desktop, etc.) to ensure seamless communication and productivity. Urgency: Due to the nature of the role, it is essential that all candidates have these resources in place from day one to avoid any delays in onboarding or task completion. POSITION We are looking for a Language Data and Quality Reviewer with proficiency in Korean and English to join our team. This role is critical in researching and analyzing data for various entities, tools, and datasets that will be introduced through on-the-job training. The ideal candidate should have a background in technology, with strong logical and analytical skills to assess data and provide valuable insights. While prior experience in similar roles is beneficial, we encourage candidates with some experience in data analysis, quality assurance, or related fields to apply, especially those looking to grow their skills in a global, dynamic work environment. Key Responsibilities Data Interpretation: Analyze datasets, translating raw data into actionable insights that can support business improvement strategies. Data Manipulation: Handle data batches, apply labeling techniques, and manipulate data according to project requirements, ensuring high accuracy. Quality Assurance: Oversee the quality of training data, identify issues or anomalies, and implement corrective measures to maintain data integrity. Language Translations: Provide translations and contextual understanding where necessary to ensure data is aligned with language and cultural nuances. Recommendations: Offer suggestions aimed at improving business processes and outcomes based on your data analysis. Desired Qualifications Some experience in data labeling, manipulation, or quality assurance, particularly in technology or related fields. A proactive attitude towards continuous improvement, staying updated with new advancements in AI technologies and data analysis techniques. Logical and analytical skills to ensure data accuracy and support project goals. Required Skills Proficient in Korean and English. Excellent logical reasoning and analytical skills, with the ability to interpret complex datasets and derive meaningful insights. Experience with data labeling and manipulation techniques, ensuring accuracy and reliability in data processing. Strong attention to detail and a proactive approach to identifying and addressing data quality issues. Required Qualifications Proficiency (reading, writing, and/or speaking) in Korean and English. Strong computer skills, particularly in typing and writing. Meticulous attention to detail. Proactive attitude with a commitment to fostering positive experiences for others. If you are certified as a Linguist, it is considered a plus! Interview Process Submissions are reviewed by a recruiter. Selected candidates will be invited to complete an Applicant Response Form and may be invited to a first and final interview. Additional Requirements Must have own device (laptop/desktop). Currently hiring for Freelance/Task-based (ranging from 0 to 20 hours a week!). Candidate must be available in IST (preferred 8am IST onwards). Must have access to good Wi-Fi connection during working hours. This role is a 1099 independent contractor position. Please note that this classification may vary based on your location and local regulations. For most candidates outside of the US, a W-8 BEN form is provided. Onboarding & Compliance Requirements All global contractors will be onboarded through our platform, Deel.com, to ensure alignment with international compliance standards. Successful completion of onboarding is required to begin work, which includes submitting the necessary documentation within the specified timeline. Candidates should be prepared to provide accurate and compliant documents according to the requirements of their region. Compensation USD $5.00 to $10.00 per hour This is an exciting opportunity for a remote freelance position! Please kindly note that hours are dependent on the volume of tasks given by the client. Perfect for a supplemental income opportunity. We look forward to receiving your application!"
4304540022,TableCheck,https://www.linkedin.com/company/tablecheck/life,"Lead Full-Stack Engineer (Ruby on Rails, JavaScript, WeChat Mini-Programs)","Chuo, Yamanashi, Japan",1 month ago,,Not specified,"About the job About TableCheck TableCheck is a global platform built to help restaurants own their guest experience. We help merchants reduce their reliance on paid booking channels by directly converting first-time diners into repeat guests—and repeat guests into loyal fans. Used by over 10,000 restaurants in over 30 countries, including top hospitality brands and over 200 Michelin-starred restaurants, TableCheck has set new standards for restaurant management tools in Japan and is steadily growing to take on the challenge of becoming the world's leader in restaurant management. We operate in an English-first remote-first environment where clear communication and thorough documentation are paramount. TableCheck has embraced remote work. As such, communication and documentation are in our blood. We look for and write about signals in the noise which enables us to constantly learn and adapt, and we expect members of our teams to constantly follow up with questions and updates to keep everyone in the loop. Role Overview We're seeking a Lead Full-Stack Engineer to strengthen our China Squad in delivering exceptional products tailored for the Chinese market. Working under the supervision of the Engineering Manager, you will be a senior technical contributor and mentor who understands Chinese business culture and customer needs. You'll combine hands-on development expertise with the ability to guide technical decisions, helping the squad deliver high-quality products that resonate with our rapidly growing Chinese customer base. This role requires someone who excels at both frontend and backend development while understanding the unique requirements of the Chinese market. While there will be a strong focus on WeChat ecosystem integrations, you'll also work with various other Chinese platforms and payment systems. You'll be responsible for implementing complex features while mentoring other engineers and maintaining our high engineering standards. What we're looking for Required Qualifications 5+ years of full-stack development experience with strong proficiency in both frontend and backend Strong experience in Ruby on Rails and Javascript Hands-on experience with WeChat Mini-Programs development and WeChat ecosystem integrations Fluent Mandarin Chinese proficiency with deep understanding of Chinese business culture Fluent English communication skills for collaboration with global teams Experience with Chinese payment systems (WeChat Pay, Alipay, UnionPay) Strong ability to understand business requirements and passion for solving customer problems Nice to haves Experience with Ember.js or React for frontend development Familiarity with Chinese F&B industry and restaurant operations Experience with Chinese cloud providers (Alibaba Cloud, Tencent Cloud) Understanding of Chinese data privacy regulations and compliance requirements Personal Attributes Moves fast, has a strong bias for impact, and seeks forgiveness, not permission Strong communication and collaboration skills with a team-first mindset Excellent cross-cultural communication skills with ability to work effectively across different cultural contexts Interview Process Resume screening by HR. Please submit your resume/application in English. Resumes/applications submitted in any other language will be rejected. Cultural fit screening with HR(60 minutes) Async take-home assignment (~1 week, negotiable) Take-home review / technical interview call with the engineering manager and/or team members (60 minutes) Final interview with CTO (~1hr or less) Work Arrangement Remote-first position with flexibility to work from anywhere At least 4 hours overlap with our core hours of 11:00 ~ 19:00 GMT+9 is required. Occasional travel to China for client meetings and team gatherings may be required Join us in revolutionizing the restaurant industry in one of the world's most dynamic markets!"
4286650013,Canonical,https://www.linkedin.com/company/canonical/life,Junior Linux Kernel Engineer - Ubuntu,Remote,Reposted 1 week ago,,Not specified,"About the job Canonical is a leading provider of open source software and operating systems to the global enterprise and technology markets. Our platform, Ubuntu, is very widely used in breakthrough enterprise initiatives such as public cloud, data science, AI, engineering innovation, and IoT. Our customers include the world's leading public cloud and silicon providers, and industry leaders in many sectors. The company is a pioneer of global distributed collaboration, with 1200+ colleagues in 75+ countries and very few office-based roles. Teams meet two to four times yearly in person, in interesting locations around the world, to align on strategy and execution. The company is founder-led, profitable, and growing. Every year we select new junior professionals into the Canonical Kernel Team, to work on the Linux kernel for Ubuntu. If you’ve enjoyed operating systems in your coursework or current role, you are confident in your ability to write high quality C and possibly Rust, and are ready to take the plunge and see how it all works, then this would be a great place to pursue your next career stage. We are a global team working to ship the world's most widely used Linux kernel, across the very latest silicon and cloud, where you can apply and grow your software engineering skills. The Canonical Kernel Team builds and maintains all supported Ubuntu Linux kernels for a variety of platforms and architectures from small embedded devices to standard desktop/server systems to large-scale cloud environments. In your first year you will tackle serious initiatives, which include but are not limited to: Optimized solutions for key Silicon and Cloud partner platforms Developer platforms such as Raspberry Pi and RISC-V Enabling Ubuntu on a wide range of embedded systems Security hardening and exploit mitigation Third-party driver integration and distribution, such as graphics Expanded driver support for bleeding-edge PC platforms We select candidates that are recent university graduates or early career professionals who are enthusiastic to develop kernel-level software in multiple areas including security updates, patching, and testing. The successful candidate will have a background in software engineering, be motivated to work in a distributed team and willing and able to travel globally twice a year for company engineering events. These are full-time positions available to prospective or recently graduated students. Location: We have home-based Kernel Teams in every timezone. The role entails Collaborate regularly and proactively with a globally distributed team Learn from senior mentors to demystify the inner workings of the Linux kernel and how it is distributed Work closely with external silicon, cloud, or hardware manufacturer delivery teams on bleeding-edge platforms Diagnose and resolve issues in the kernel reported by customers, the community, and discovered by your own rigorous testing Take personal responsibility for the delivery of various flavors of the Ubuntu Linux kernel Improve tooling and automation for delivery and test of Ubuntu Linux kernels Submit, review, and apply kernel patches, working with both internal and external upstream maintainers What We Are Looking For In You Well-organized and motivated self-starter able to thrive in a remote work environment Professional manner with colleagues, business partners, and the open-source community Ability to communicate effectively in English, both written and verbal Programming experience in C and/or Rust Familiarity with version control practices, ideally with git Understanding of operating system kernel fundamentals Ability to travel twice a year for company events of up to two weeks length Nice-to-have Skills Interest and experience in Rust Python and Bash scripting ability Prior experience with Ubuntu/Debian/Snap packaging Demonstrated experience with kernel patching and debugging Strong grasp of device drivers, BSP’s, and other low level system engineering What We Offer Colleagues We consider geographical location, experience, and performance in shaping compensation worldwide. We revisit compensation annually (and more often for graduates and associates) to ensure we recognize outstanding performance. In addition to base pay, we offer a performance-driven annual bonus or commission. We provide all team members with additional benefits which reflect our values and ideals. We balance our programs to meet local needs and ensure fairness globally. Distributed work environment with twice-yearly team sprints in person Personal learning and development budget of USD 2,000 per year Annual compensation review Recognition rewards Annual holiday leave Maternity and paternity leave Team Member Assistance Program & Wellness Platform Opportunity to travel to new locations to meet colleagues Priority Pass and travel upgrades for long-haul company events About Canonical Canonical is a pioneering tech firm at the forefront of the global move to open source. As the company that publishes Ubuntu, one of the most important open-source projects and the platform for AI, IoT, and the cloud, we are changing the world of software. We recruit on a global basis and set a very high standard for people joining the company. We expect excellence; in order to succeed, we need to be the best at what we do. Most colleagues at Canonical have worked from home since our inception in 2004. Working here is a step into the future and will challenge you to think differently, work smarter, learn new skills, and raise your game. Canonical is an equal opportunity employer We are proud to foster a workplace free from discrimination. Diversity of experience, perspectives, and background create a better work environment and better products. Whatever your identity, we will give your application fair consideration."
