linkedin_job_id,company_name,linkedin_company_page,title,job_location,posted_date,applicant_count,salary,description
4318923762,411 Locals,https://www.linkedin.com/company/411-locals/life,Facebook Ads Specialist,Remote,1 week ago,Over 100 applicants,Not specified,"About the job About Us: At 411 Locals, we empower small businesses worldwide through collaboration and innovation. Our mission is to provide simplified, effective, and affordable business services, enabling entrepreneurs to start, grow, and run their ventures with confidence. Join our team and be part of an environment that fosters growth, achieves results, and embraces constant innovation. Together, we create win-win-win outcomes for our customers, the company, and ourselves. Qualifications: BA/BS or equivalent working experience. Knowledge of the various paid marketing channels and technologies, including paid search (Google AdWords), retargeting, social network advertising. Experience creating ad creatives and perform A/B testing to identify high-performing designs and optimize campaign performance. Some experience handling marketing budgets and forecasting/reporting results. Good written communication skills Detailed-oriented and organized Enjoys learning new things Preferred Qualities (but not mandatory): Positive involvement with the SEO/PPC community Must stay on top of current trends and advancements in SEO/PPC technology Knowledge of Google AdWords and Microsoft Ad Center Knowledge of Google Analytics and Webmaster Tools Responsibilities: Launch and optimize various PPC campaigns Be involved in keyword selection and audience targeting Monitor budget and adjust bids to gain better ROI Track KPIs to assess performance and pinpoint issues based on KPIs and ROI Generating leads and sales using Facebook Ads Stay up-to-date with digital marketing trends and potential new channels and strategies to keep us ahead, including updates to social media marketing, attribution, and programmatic media buying. Testing variations of ads to determine best performing Continuous monitoring of results and improving of ads Reporting of results of Facebook Campaigns Manage the strategy and setup of all paid campaigns. Work Conditions: The role is 100% remote, requiring effective communication with teams across different time zones. Regular virtual meetings and reporting sessions will be an integral part of the role. Flexible working hours with overlap for team collaboration may be required. Work Timings: 1:30 PM IST to 10:30 PM IST Key Performance Indicators: ROI and performance metrics of managed campaigns. Implementation and success rate of new strategies. Overall achievement of departmental goals and objectives. 411 Locals is an Equal Opportunity Employer. We do not discriminate based on race, religion, color, sex, gender identity, sexual orientation, age, non-disqualifying physical or mental disability, national origin, veteran status, or any other basis covered by appropriate law. All employment is decided based on qualifications, merit, and business need."
4318450078,"BLOOMTECH, Inc",https://www.linkedin.com/company/bloomtech_career/life,Webアプリケーションエンジニア_FullyRemote,"Tokyo, Japan",1 week ago,"Tokyo, Japan · 1 week ago · 15 applicants
Promoted by hirer · Actively reviewing applicants",Not specified,"About the job ★求人のポイント★ ◎フルリモート×フレックス勤務！ ◎外国籍活躍中 → N2以上の日本語力があればOK！ ◎自社サービス開発企業 ■年収範囲 5,500,000 ～ 8,500,000円 ■企業情報 当社は、「100年先も続く、働くを支える」をミッションに、シフト管理クラウドサービスやアルバイト採用サービスなど、ワークフォースマネジメントプロダクトを複数展開しています。 独自開発のアルゴリズムと徹底的な顧客向き合いを強みに、労働人口の減少という身近で大きな社会課題の解決に取り組んでいます。 ▼業務内容 ・自社サービスWebアプリケーションの設計・開発・運用 ・プロダクトマネージャーやデザイナーと連携した仕様の策定 ・コードレビューや設計レビュー ・新技術やツールの調査・導入 ・その他開発チームメンバーのサポート ■必須スキル ・3年以上のwebアプリケーションの設計・開発経験 ・AWS, GCPなどクラウド環境でのサービス開発経験 ・MySQL, Gitの業務使用経験 ■歓迎スキル ・Rubyの実務経験 ・Vue.jsもしくはReactの実務経験 ・複数のエンジニアがいるチームでのアジャイル開発経験 ・Webサービスやアプリ開発における仕様策定やディレクションの経験 ・高負荷なトラフィックのあるサービスの設計・開発・運用経験 ・GCPでのシステム構築経験"
4292832123,PayNex Inc,https://www.linkedin.com/company/paynex-inc/life,Golang Development Engineer (Mandarin Speaking),Remote,Reposted 1 month ago,Over 100 applicants,Not specified,"About the job Job Responsibilities: Design and develop risk control systems, building stable and efficient real-time risk control platforms. Develop core risk control services using Go to meet high concurrency and low latency requirements. Integrate business risk control strategies, implementing rule engines and model serving. Collaborate with algorithm, data, and product teams to drive rapid iteration and optimization of risk control solutions. Continuously optimize system performance and stability, enhancing scalability and intelligence. Job Requirements: Bachelor’s degree or above in Computer Science, Software Engineering, or related fields. Proficient in Go programming with strong coding skills and engineering practices. Familiar with distributed system architecture, experienced in developing highconcurrency and high-availability services. Familiar with commonly used middleware and databases such as Kafka, Redis, MySQL, and MongoDB. Experience in risk control, anti-fraud, or credit assessment projects is a plus. Experience with model deployment and rule engine development is a plus. Strong teamwork, communication, and business understanding skills."
4319910131,PancakeSwap,https://www.linkedin.com/company/pancakeswap/life,Senior Blockchain Developer(Solidity/Smart Contract),Remote,6 days ago,Over 100 applicants,Not specified,"About the job General Information Salary range: Competitive, negotiable Position: Full-time Location: Remote Your Responsibilities Architect, implement, and test smart contracts in Solidity across EVM-compatible chains. Scope, design, and deliver complex systems end-to-end, from idea to deployment. Collaborate with cross functional partners on all aspects of product development. Conduct code reviews and enforce best practices for security, efficiency, and maintainability. Continuously evaluate and improve gas optimization, security design patterns, and upgradeability. Proactively identify areas for improvement and innovation within PancakeSwap’s protocol architecture. Skills & Qualifications 5+ years of software engineering experience, with 2+ years focused on Solidity smart contracts. Deep understanding of Solidity design patterns, gas optimization, and contract upgradeability. Hands-on experience with Hardhat and Foundry (understands the trade-offs and tooling ecosystems). Strong understanding of EVM internals, DeFi protocols, and on-chain architecture. Excellent analytical, debugging, and problem-solving skills. Comfortable working autonomously in a fast-paced, globally distributed team."
